id	sentence1	sentence2	score
788	Yes, you should mention your experience.	Yes, you should mention it.	3.2699453830718994
789	A person dices up an orange pepper.	The cook is slicing bell peppers.	2.432982921600342
790	This doesn't answer your question, but:	This is a part answer to your question	2.7952346205711365
791	A harnessed dog leaps over a log as another dog follows behind.	A brown and white dog is leaping over a log in a field while another dog follows behind it.	3.6831963062286377
792	A man is cutting paper with a sword.	A woman is cutting a tomato.	1.4929461479187012
793	A man is talking on the phone.	A man is moon-walking across a store.	0.6201109290122986
794	The panda bear lay on the logs.	A panda is lying down.	3.4806570410728455
795	Black bird standing on concrete.	Blue bird standing on green grass.	2.5761425495147705
796	There are two things to consider:	There are two possible causes for this:	0.5996642261743546
797	A man is pouring rice a roni into a pan.	A man poured ric-a-roni into a pan.	3.7057289481163025
798	A woman is posing for a Christmas card.	A girl is taking a photo.	0.8044256269931793
799	Three men posing in a tent.	Three men eating in a kitchen.	2.744174003601074
800	A very retro living room with a television in it.	A grey cat lying on a wooden table.	0.2941920608282089
801	"Kids, adults, booksellers and postal workers all are preparing for ""Harry Potter and the Order of the Phoenix."""	"The crates are full of hardback copies of ""Harry Potter and the Order of the Phoenix."""	1.6649505496025085
802	a black and white dog jumping in the air to catch a Frisbee	A black and white dog jumping in a yard.	3.140072226524353
803	A young girl with dirt on her face and a red child's bike is in the background.	The old woman in shorts and a white t-shirt is standing on a path watching children play.	0.7199141383171082
804	A man is playing the drums.	A man is playing the guitar.	1.9165459275245667
805	Yes, it is possible to publish a paper on model analysis.	Yes, it is hard to publish in a peer reviewed journal.	1.8603016436100006
806	A child wearing blue and white shorts is jumping in the surf.	A girl wearing green twists something in her hands.	0.3360547870397568
807	This is a great one... 	This is a difficult one.	1.7692974209785461
808	What kind of insulation is it?	What kind of floors are above?	1.2669481337070465
809	A boy is crawling into a dog house.	A boy is playing a wooden flute.	0.7972981035709381
810	The American Express Corp. has pledged at least $3 million of more than $5 million needed.	The city had requested federal funds, but withdrew that request when American Express pledged at least $3 million.	3.669559359550476
811	His 1996 Chevrolet Tahoe was found abandoned in a Virginia Beach, Va., parking lot June 25.	His sport utility vehicle was found June 25, abandoned without its license plates in Virginia Beach, Va.	3.481934070587158
812	The head of a child with dark glasses is in focus.	There is a woman with a full head of hair.	1.1667948961257935
813	a small bird sitting on a branch in winter.	A small bird perched on an icy branch.	4.385370910167694
814	To give this an answer:	I'll answer this question:	2.9585105180740356
815	The woman is measuring the other woman.	The lady measured the other woman's ankle.	3.627517521381378
816	Q: Can I buy coverage for prescription drugs right away?	Congress has added a new benefit - an option to buy insurance coverage for prescription drugs.	2.678866982460022
817	A young boy with his hair standing up, is sliding down a blue slide	The kid in the orange shirt is sliding down a teal slide.	2.3631998896598816
818	A man is playing piano.	A man is playing a violin.	2.0644310116767883
819	A woman opens a window.	A woman is looking out a window.	3.992951214313507
820	The men played follow the leader on the grass.	The rhino grazed on the grass.	1.5195487439632416
821	A yellow bird is eating fruit on a wire grate.	A yellow bird eating fruit on a bird feeder.	4.424375295639038
822	You don't have to know.	You don't have equipments/facilities to do research in B.	1.094287484884262
823	Bremer, 61, is a onetime assistant to former Secretaries of State William P. Rogers and Henry Kissinger and was ambassador-at-large for counterterrorism from 1986 to 1989.	Bremer, 61, is a former assistant to former Secretaries of State William P. Rogers and Henry Kissinger.	3.635416030883789
824	There are two possible causes for this:	There are two options for you - 	0.7486305385828018
825	A woman puts make-up on.	A woman is putting on eyeshadow.	2.959868609905243
826	A large pile of wooden items piled high.	A large pile of scrap wood.	3.4265413880348206
827	You don't have to know.	You have no need to do anything.	2.4897997081279755
828	I think you've pretty much done your review.	You've pretty much answered your own question.	1.7242038249969482
829	A little girl in an orange striped outfit is airborne whilst bouncing on a bed.	A dog in a red shirt is chasing a squirrel through the glass.	0.04550307057797909
830	Vietnamese citizens need a visa to visit the USA.	Nepalese citizens require a visa to visit the UK.	1.3237018883228302
831	Rocky and Apollo Creed are running down the beach.	The men are jogging on the beach.	2.8511345386505127
832	Hormone replacement therapy that combines estrogen and progestin doubles a woman's risk of breast cancer, a British study of more than a million women has found.	A major British study has added to the evidence that hormone replacement therapy increases the risk of breast cancer, especially when women receive a combination of estrogen and progestin.	4.542226195335388
833	You just have to base your answer on what you do know, which is what you want.	So if that's what you need, you really do have to be explicit about it.	1.8351967632770538
834	A green car parked at a saloon.	A green car parked outside the saloon.	4.815972447395325
835	Three children playing on a floor with toys.	Three children sitting in floor playing with several toys.	4.802147448062897
836	A women painting a chair with a dining room in the background.	A man and boy walking along a beach with the sea in the background.	0.11035304516553879
837	Lawtey is not the first faith-based program in Florida's prison system.	But Lawtey is the first entire prison to take that path.	2.892885208129883
838	You don't have to worry.	Since you have one ticket, you don't have to worry.	3.06566059589386
839	It will take time to oust die-hard remnants of Saddam Hussein's deposed regime in Iraq, Defense Secretary Donald H. Rumsfeld said Tuesday.	Defense Secretary Donald H. Rumsfeld said Tuesday it will take time to locate die-hard remnants of Saddam Hussein's deposed regime in Iraq.	4.486594200134277
840	The American conservatives are clearly in the minority within the Episcopal Church.	The letter indicates the Vatican's interest in bolstering conservatives within the Episcopal Church.	2.559671700000763
841	Perry has since called two special legislative sessions to try force the redistricting plan through.	Since then, Texas Gov. Rick Perry has called two special sessions trying to push the measure through.	3.7567901611328125
842	Yucaipa owned Dominick's before selling the chain to Safeway in 1998 for $2.5 billion.	Yucaipa bought Dominick's in 1995 for $693 million and sold it to Safeway for $1.8 billion in 1998.	4.119695425033569
843	four children are playing on a trampoline.	Four kids are jumping on a trampoline.	4.654929935932159
844	The dog plays in the park.	The dog leaps over the fence in the park.	3.75119686126709
845	Advanced Micro Devices said Fujitsu Siemens Computers is offering a high-end workstation based on AMD's Opteron 200 Series.	Fujitsu Siemens Computers on Tuesday made good on a promise to offer a workstation based on Advanced Micro Devices' Opteron processor.	3.836658298969269
846	I am not sure this is the right site for the question.	I am not sure this question would have made much sense to the Romans themselves.	1.4418551325798035
847	What are your goals?	What are you goals?	4.927266240119934
848	This is a terrible idea.	This is a bad idea.	4.384540617465973
849	On Monday, the Dow declined 5.25, or 0.1 percent, at 8,983.80, having shed 2.3 percent last week.	In early trading, the Dow Jones industrial average was down 39.94, or 0.4 percent, at 8,945.50, having slipped 3.61 points Monday.	2.941569685935974
850	You just have to base your answer on what you do know, which is what you want.	It is his job to see that you have what you need to do your job.	1.2260454148054123
851	A cat is eating some corn.	A cat is eating corn on the cob.	4.6372681856155396
852	A black train moves down the tracks.	A long train is on train tracks.	2.6760101318359375
853	A turtle is swimming in water.	A turtle is walking underwater.	3.8281840085983276
854	Blue couch and twin bed in a living room.	Blue couch in room with sun shining in.	3.4950482845306396
855	A woman is playing a guitar and singing.	A woman is playing the guitar.	4.029256999492645
856	A man is cutting pieces of butter into a mixing bowl.	Pieces of butter is added in the stand mixer.	3.6715108156204224
857	Hope this is what you are looking for.	If what you are looking for is much higher, they get the picture.	1.3308532536029816
858	The dog is running through a field.	A dog runs through a field.	4.896906614303589
859	Boy lies on stomach in grass.	Small boy lying on his stomach on the grass.	4.711528718471527
860	There is no maximum.	There is no quarantine period.	1.812443733215332
861	Maybe this could work for you.	Maybe this can work for you.	4.839996695518494
862	Authorities appealed to the public Friday to come forward and provide what could be the key to solving the sniper-style shootings that have killed three people outside area convenience stores.	Authorities looked to the public yesterday for help in solving the deadly sniper-style shootings of three people outside Charleston-area convenience stores.	4.179984033107758
863	Sources within the racing industry have told the Daily Bulletin that Fontana will get a second NASCAR race on Labor Day weekend starting next season.	Sources in the racing industry said Fontana will get a second NASCAR race on Labor Day weekend starting next season.	4.838590621948242
864	It looks to me that this is set up for what you want:	It is up to you whether you want to do that.	1.9494494795799255
865	I had the same problem as you.	I had the same issue.	4.131696820259094
866	MediaQ's customers include major handheld makers Mitsubishi, Siemens, Palm, Sharp, Philips, Dell and Sony.	Nvidia will take advantage of MediaQ customers, which include such players as Siemens AG, Sharp, Philips, Dell, Mitsubishi and Sony Corp.	3.7326177954673767
867	Three sheep on a dirt road viewed from a passenger vehicle.	Three sheep on a dirt road shot from a car.	4.400240480899811
868	The AFL-CIO is waiting until October to decide if it will endorse a candidate.	The AFL-CIO announced Wednesday that it will decide in October whether to endorse a candidate before the primaries.	4.323852360248566
869	A man is opening a box and taking out paper.	A woman is peeling a potato.	0.32524891197681427
870	Four girls in swimsuits are playing volleyball at the beach.	Four ladies in swimsuits play sand volleyball on the beach.	4.530156850814819
871	Governor Gray Davis estimated yesterday that the fires could cost nearly $2 billion.	State officials estimated the cost at nearly $2 billion.	3.1921210885047913
872	A dog taking a poop in the street.	A man making balloon animals for two children on a street corner.	0.8213721215724945
873	Frank Quattrone, the former Credit Suisse First Boston technology investment-banking guru, reportedly pleaded not guilty Tuesday to charges of obstruction of justice and witness tampering.	NEW YORK -(Dow Jones)- Former star investment banker Frank Quattrone pleaded not guilty Tuesday to criminal charges of obstruction of justice and witness tampering.	4.344609081745148
874	There are a couple of options that you could consider:	There are a lot of ways that could go poorly for you.	0.8558126538991928
875	It really depends on how the employer documents it.	It depends how you're stating it.	1.6939546167850494
876	Gillespie sent a letter to CBS President Leslie Moonves asking for a historical review or a disclaimer.	Republican National Committee Chairman Ed Gillespie issued a letter Friday to CBS Television President Leslie Moonves.	3.5018014907836914
877	"The New York senator's new book, ""Living History,"" appears a certain bestseller."	Hillary Clinton, the New York senator and former first lady, has a book out Monday titled Living History.	3.3298838138580322
878	The attack seemed similar to others staged near foreign compounds in Riyadh on May 12.	The attack seemed similar to attacks staged near foreign compounds in Riyadh on May 12, for which officials have also blamed al-Qaida.	4.448861479759216
879	Deirdre Hisler, Government Canyon's manager, said the state has long had its eye on this piece of property and is eager to complete the deal to obtain it.	Deirdre Hisler, Government Canyon's manager, said the state long has coveted this piece of property, and is eager to complete the deal.	4.6377792954444885
880	A person is slicing some onions.	A woman is chopping herbs.	1.5161505341529846
881	Someone is slicing two uncooked racks of ribs apart.	Someone is cutting a piece of meat.	2.150528132915497
882	A boy is playing the violin onstage.	A boy is playing an instrument.	3.4859561920166016
883	A man is cutting a potato.	A man is slicing some potato.	4.603190720081329
884	A person driving a cart pulled by a bicycle.	A man wearing a dust mask riding a three wheeled bicycle.	2.4371327459812164
885	You are on the right path.	You're right on about the sample definition.	0.36820948123931885
886	A girl is running on a desert path.	A young girl is talking on a cell phone.	0.844598263502121
887	A woman is dancing near a fire.	A woman is cutting a tomatoe.	0.4598749801516533
888	A polar bear is running towards a group of walruses.	A polar bear is chasing a group of walruses.	4.469199478626251
889	There are a few things you can do: 	There are a couple things you can try.	3.127889633178711
890	Three boys in karate costumes are fighting.	Three men are practicing karate moves in a field.	3.325745463371277
891	Three goats are being rounded up by a dog.	Three goats are chased by a dog.	4.076642692089081
892	The injured were taken to hospitals in Jefferson City and Columbia, a college town about 30 miles to the north.	The injured were taken to hospitals in Jefferson City and Columbia, about 48km north; their conditions were not immediately available.	3.027951717376709
893	A dog under the stairs	A dog is resting on the stairs.	4.298655390739441
894	"So in his State of the Union address in January, Bush declared that the British government ""has learned that Saddam Hussein recently sought significant quantities of uranium from Africa."""	"In his Jan. 28 State of the Union message, Bush said, ""The British government has learned that Saddam Hussein recently sought significant quantities of uranium from Africa."""	4.419194459915161
895	He was tracked to Atlanta where he was arrested on Tuesday night.	He was arrested in Atlanta, Georgia, on Monday night by police acting on a tip-off.	3.5824966430664062
896	Shares of McDonald's Corp. and Wendy's International Inc. continued a modest run-up on the New York Stock Exchange Monday.	Shares of McDonald's and Wendy's continued their recent recovery Monday, rising more than 1 percent on the New York Stock Exchange in afternoon trade.	3.7892141938209534
897	A man and woman sit at a table in a restaurant.	Four women and two men sit at a long table in a restaurant.	3.350944221019745
898	On health care, the NDP says there will be no privatization and no health-care premiums.	The New Democrats also renewed their commitment to no health-care privatization and no premiums.	4.0373387932777405
899	Two women are dancing and singing in front of a crowd.	The women are singing and dancing.	4.089790880680084
900	Sure, I've  done this very trip.	I've done this many dozens of times.	2.1287089586257935
901	It's all in her head.	It's all about adhesion.	1.1617948114871979
902	An empty office cubicle.	An empty office chair in a cubicle.	3.9874672889709473
903	Two men wearing traditional clothing is standing outside.	Three women wearing black vests and gray shirts are talking outside of a building.	0.5062796920537949
904	You don't have to worry.	You don't have to do anything to season it.	1.9990867376327515
905	The Cradle of Liberty Council isn't the first one to buck the national group's stance.	Philadelphia's council is not the first to defy the national policy.	2.9212889075279236
906	A baby elephant is eating a small tree.	A little girl peddling a scooter.	0.04412688780575991
907	You just have to base your answer on what you do know, which is what you want.	You have to do what is right for you.	1.411881148815155
908	A woman is slicing ginger.	A person is holding two baby lorises.	0.239541158080101
909	A man is opening a door.	A man is cutting an onion.	1.1290962994098663
910	One witness told Anatolian he saw the plane on fire while it was still in the air.	One witness told the Anatolian news agency he saw the plane on fire in mid-air.	4.5564475655555725
911	A man sits by a dock looking at the water.	A man jumps off a rock into the water	2.2204414010047913
912	It''s absurd, Funny Cide's trainer Barclay Tagg said.	"Meanwhile, Funny Cide's trainer, Barclay Tagg, called the allegations ""ridiculous."""	4.167660176753998
913	Someone typed on a keyboard.	Someone is typing.	4.389849305152893
914	A black and white dog is jumping over a hurdle.	A white dog running over a bridge.	2.055393159389496
915	There are a total of 659 women enrolled at the academy, the report said.	There were 659 women enrolled at the academy at the time of the survey.	4.626836180686951
916	A young woman is riding a Bay hose in a dirt riding-ring.	A man is staring at a horse with a white mane.	0.3699328377842903
917	Tony's not feeling well, Spurs coach Gregg Popovich said.	We're thrilled to be up 3-2,'' Coach Gregg Popovich said Wednesday.	2.1448661386966705
918	Three bicyclists crossing a bridge in a city.	The bicyclists are crossing a bridge in the rain.	3.452734351158142
919	For the full 12-month period, high-speed cable modem connections increased by 49 percent.	For the full year period ending June 30, 2003, high-speed lines increased by 45 percent.	2.3386912047863007
920	Does this page answer your question?	Does this answer your questions?	3.96606981754303
921	Two green and white trains sitting on the tracks.	Two green and white trains are sitting on the train track.	4.873155355453491
922	But Mitsubishi Tokyo Financial (JP:8306: news, chart, profile) declined 3,000 yen, or 0.65 percent, to 456,000 yen.	Sumitomo Mitsui Financial (JP:8316: news, chart, profile) was down 2.5 percent at 198,000 yen.	2.5584712624549866
923	Knox County Health Department is following national Centers for Disease Control and Prevention Protocol to contain infection.	The health department spokesperson added the department is following Centers for Disease Control protocol.	3.1403297185897827
924	You can use it, too.	Yes, you can do it.	2.039046734571457
925	A blue bird standing on a lawn.	Blue bird standing on green grass.	4.541168212890625
926	"They said they had concluded that the film failed ""to present a balanced portrayal"" of the Reagans."	"CBS said the show ""does not present a balanced portrayal of the Reagans for CBS and its audience."	3.109992742538452
927	Three people are by the water with yellow canoes.	Three people preparing to canoe.	4.006234705448151
928	This is not a good idea.	This is probably not a good idea but I will suggest it anyhow.	2.9558444023132324
929	A man in a blue dress shirt.	A man in a white shirt and blue pants is talking with a woman in a pink shirt.	1.6913023591041565
930	You can use it, too.	You can still use it for practice.	2.8623998165130615
931	Hilsenrath and Klarman each were indicted on three counts of securities fraud.	Klarman was charged with 16 counts of wire fraud.	2.0359638333320618
932	What is your lid made of?	What is your paper for?	0.4620687663555145
933	In the second quarter, Anadarko now expects volume of 46 million BOE, down from 48 million BOE.	Production for the second quarter was cut to 46 million barrels from 48 million barrels.	3.237907886505127
934	Now, with the agency's last three shuttles grounded in the wake of the Columbia disaster, that wait could be even longer.	With the remaining three shuttles grounded in the wake of the Columbia accident, the rookies will have to wait even longer.	4.2042893171310425
935	Trading in Loral was halted yesterday; the shares closed on Monday at $3.01.	The New York Stock Exchange suspended trading yesterday in Loral, which closed at $3.01 Friday.	4.203704595565796
936	Two children splashing in the water.	Two dolphins jumping into the water.	1.8317025899887085
937	You should just ask your boss what he wants you to do.	You should listen to your boss, because you're not paid to tell the boss what to do.	2.868669629096985
938	Train in a station.	a train in a station.	4.932722747325897
939	"It is a national concern that will touch virtually every American,"" Abraham said."	"The impact of natural-gas shortages ""will touch virtually every American,"" Energy Secretary Spencer Abraham warned yesterday."	3.514000177383423
940	But the country is scrambling to prevent it spreading to the vast countryside where most of its 1.3 billion people live.	China is scrambling to stop the disease from spreading to the countryside, where most of its 1.3 billion people live.	4.290561676025391
941	About 1,557 genes on chromosome 6 are thought to be functional.	The remaining 1,557 genes are believed to be all functional.	3.86654794216156
942	I was in a similar situation.	I had a similar situation.	4.450792074203491
943	The security official's backup couldn't fill in because he was on active military duty, Strutt said.	The security official's backup was on active duty, and the lottery association didn't have a replacement in New Jersey, Strutt said.	3.148818612098694
944	Two men pushed carts through the woods.	Two men are pushing carts.	3.990693986415863
945	Bashir felt he was being tried by opinion not on the facts, Mahendradatta told Reuters.	Bashir also felt he was being tried by opinion rather than facts of law, he added.	3.5354572534561157
946	Three people are meeting for coffee.	Two people make coffee.	2.9899391531944275
947	A baby panda goes down a slide.	A panda slides down a slide.	4.345382750034332
948	A dog standing in the water.	A girl playing on a parachute.	0.017763031646609306
949	A cruise ship is in front of a docking area.	Calico cat sitting on step in front of a door.	1.0565830767154694
950	There are four people outside.	Five people are outside.	2.580260932445526
951	A woman is swimming underwater.	A man is slicing some carrots.	-0.6008796021342278
952	A man is stirring juice.	A man is peeling an onion.	1.1826499551534653
953	A person is playing an electronic keyboard.	A kid is playing keyboard.	3.8724640011787415
954	A cheetah is running behind its prey.	A cheetah chases prey on across a field.	4.0753039717674255
955	It's pretty much up to you.	It is up to you.	4.090249538421631
956	Red and white bus driving down road.	A bus drives down a busy road.	3.7490859627723694
957	A 25 percent increase would raise undergraduate tuition to about $5,247 annually, including miscellaneous, campus-based fees.	The 25 percent hike takes annual UC undergraduate tuition to $4,794 and graduate fees to $5,019.	2.9671987891197205
958	A woman is pouring egg into a frying pan.	A man is petting two dogs.	-0.26025693863630295
959	You guys are making this all WAAAAAY too complicated.	You are making this too complicated.	3.679732382297516
960	Black and white photo of a girl on a sofa.	a black and white photo of a cow under a tree.	0.7857494056224823
961	A man is smoking.	A baby is sucking on a pacifier.	0.5952687188982964
962	The cat is sitting on a bag of cat food.	Two eagles sitting on a long branch.	0.4718024283647537
963	I've had this same problem.	I had this same situation.	3.7295812368392944
964	The consensus among Wall Street analysts was for a loss of 28 cents a share.	Analysts surveyed by First Call were expecting sales of $723 million and a loss of 28 cents a share.	3.3880168199539185
965	A black and white dog is running through the grass.	A tan dog is walking through snow.	1.4578714966773987
966	Vivendi shares closed 1.9 percent at 15.80 euros in Paris after falling 3.6 percent on Monday.	In New York, Vivendi shares were 1.4 percent down at $18.29.	1.9563539326190948
967	The boy is raising his hand.	The man is raising his hand.	4.009866416454315
968	From what I understand this is what you can do :	Can you do this?	1.9149249792099
969	This is not a good idea.	Not a good idea.	4.201542139053345
970	The rule - When in doubt throw it out!	"I always go by the rule ""When in doubt, throw it out!"	4.426724016666412
971	I don't think that there's any.	I don't think there is any universal term.	1.5181881189346313
972	A man is laughing with a woman	A man and a woman laughing.	4.730719327926636
973	a close up head of an ostrich.	A close up of an ostrich face.	4.5638251304626465
974	Kansas Department of Health and Environment records show there were 88 abortions performed on girls age 14 and younger last year.	Statistics from the Kansas Department of Health and Environment show that 11,844 abortions were performed in the state last year.	3.7853777408599854
975	A person filming the outdoors.	There is a couple outdoors.	1.4467482268810272
976	A woman is slicing an onion.	A woman is slicing lemons.	2.331145405769348
