id	sentence1	sentence2	score
0	It's not a good idea.	I do not think it's a good idea.	4.001187086105347
1	A group of people are sitting at at a beach on towels watching the Blue Angels.	A group of people are sitting at a beach watching the Blue Angels.	4.475231766700745
2	two white standard poodles play with a toy in the snow	Two dogs fighting in the snow.	2.262587696313858
3	You got it right.	You've got it right.	4.123034179210663
4	Someone is on a blanket.	The person is making a blanket.	4.577112197875977
5	A man is cutting a pipe with scissors.	A man is cutting carpet with a knife.	2.383686900138855
6	A woman is wrapping tofu.	A woman is balling dough.	1.9778014719486237
7	A woman is braiding her hair.	A man is riding a motorcycle.	-0.30829984694719315
8	Someone is slicing a onion.	Someone is carrying a fish.	0.21065792068839073
9	The two officers are driving	Two officers are on horses.	2.4002277851104736
10	A man is playing guitar.	A lady is playing the guitar.	3.6413511633872986
11	A man puts three pieces of meat into a pan.	A man is putting meat in a pan.	3.967732787132263
12	I agree with the other comments.	I agree with the previous comments.	4.174538254737854
13	Two dogs playing in snow.	Two dogs playing in grass.	3.169681131839752
14	How should I proceed about this?	So how should I do this?	2.4177008867263794
15	U.S. troops encountered no resistance during the five-hour sweep near Tikrit, Saddam Hussein's hometown and the center of a region of Baath Party supporters.	Tikrit is Saddam Hussein's hometown and the region around it is known as a hotbed of Baath Party supporters and former high-ranking Iraqi military officials.	2.7362769842147827
16	A group of teenagers jumping and having a good time.	A group of kids having a good time.	2.9514628648757935
17	The dollar fell as low as $1.1624 per euro from $1.1486 on Friday, and traded at $1.1594 at 10:15 a.m. in London.	The dollar dropped to $1.1564 per euro at 7:30 a.m. in London from $1.1486 on Friday.	3.4157872200012207
18	Someone is slicing an onion.	A woman is cutting onion.	4.209215044975281
19	A Philips flat-screen TV is shown with its two remote controls.	A Phillips flat screen TV with two remote controls.	4.729405045509338
20	Brown and black dogs on snow, showing teeth and barking at each other.	A black dog fighting with a brown dog in the snow.	3.7151682376861572
21	A woman is folding paper.	A woman is applying eye shadow.	1.5437181293964386
22	The new companies will begin trading on Nasdaq today under the ticker symbols PLMO and PSRC.	Also as part of the deal, PalmSource stock will begin trading on the NASDAQ stock market Wednesday under the ticker symbol: PSRC.	3.533901572227478
23	The young woman is flirting with the young boy.	The girl is young and cheery.	1.1698482930660248
24	Two girls are running.	Three boys are running.	1.6045987606048584
25	A man is hitting a boy with flower vase.	A man is cutting a mat.	1.0138163715600967
26	I remained under the banyan tree, exhausted by my daily ritual of dragooning the men every two hours. 	I remained under the banyan tree, exhausted by my daily ritual of herding the cats every two hours. 	3.969883918762207
27	Second comes HP (27 percent with $2.9 billion, up just 0.4 percent).	HP fell to second place with server sales growing 0.4 percent to $2.9 billion.	2.6931369304656982
28	"I think we made the right case and did the right thing."""	"Mr Blair went on: ""I think we did the right thing in relation to Iraq."	2.7378037571907043
29	The curious boys look in the shed.	Two small boys in a woody area looking at a shed.	4.074684977531433
30	A girl is applying makeup on her face.	A woman is putting on makeup.	3.815598487854004
31	A man is doing a stunt on his bicycle.	A man is doing a wheelie on his motorcycle.	2.577989101409912
32	A group of kids are having a jumping contest.	A group of kids are having a sleepover.	1.891581118106842
33	It depends on what you want to do next, and where you want to do it.	In other words, it depends on where you go, when you do there and how.	2.5790220499038696
34	A green and white cargo plane taking of from an airport.	White and green commercial airliner taking off of runway.	3.4359589219093323
35	A man with a bicycle at a coffee house.	Man walking bicycle to patio of a coffee shop.	4.022997319698334
36	Taylor's aides warn an abrupt departure could trigger more chaos, a view shared by many in Liberia and, in private, even by mediators.	His aides warn an abrupt departure could trigger more bloodshed, a view shared by many in Liberia.	3.878050148487091
37	Beer bottles (-LRB- Harp Lager )-RRB- lined up on the floor.	A row of beer bottles on the floor.	3.9707565307617188
38	Sometime if you really want it you might need to pay an agency to get the place for you.	You could probably get a tour agency to do it for you but it would cost you.	2.0700062811374664
39	The surfer does a flip off of a wave.	A surfer does a flip on a wave.	4.902762770652771
40	It depends on what they are.	It depends on how it's used.	2.9097560048103333
41	I have the same thing.	I had the same problem as you.	2.9834699630737305
42	A man is sitting and smoking.	A man is smoking a cigarette.	4.129859805107117
43	You should do it.	You can do it, too.	2.67608106136322
44	Man in yellow canoe paddling through water.	Man paddling a yellow canoe towards a the shore.	4.588763415813446
45	A black hooded man is using a large magnifying glass to look at a booklet.	A white hooded woman is using a magnifying glass to look at a booklet.	3.7699246406555176
46	Not a direct answer to the question, but something to consider.	Not a real answer to your question, but maybe it helps.	2.8701987862586975
47	A dog is playing with a toy.	A dog is eating a doll.	2.5765377283096313
48	It is more deciding what you should do and what you should get others to do.	Point is: know what you want and don't be afraid to ask for it.	1.3124299049377441
49	A woman is cutting some fish.	A woman is cutting tofu.	1.942756474018097
50	The blue-chip Dow Jones industrial average .DJI fell 86.56 points, or 0.94 percent, to 9,109.99, after giving up more than 1 percent earlier.	The Dow Jones industrial average .DJI fell 79.43 points, or 0.86 percent, to 9,117.12 on Friday.	3.5748204588890076
51	A man is playing the drums.	A woman is slicing some leaves.	0.22683091461658478
52	The giant rock was first observed on August 24 by Lincoln Near-Earth Asteroid Research Program, based in Socorro, New Mexico.	The rock was first observed by the Lincoln Near Earth Asteroid Research Program, also known as LINEAR.	3.431631028652191
53	A man is playing drums.	A man is playing his guitar.	1.9624638557434082
54	A person is slicing an onion.	A person cuts ginger.	1.3879206776618958
55	I've located an article that might be of some help: http://www.dsattorney.com/qa-pseudonyms-in-contracts/	I found some link that might be of help to you:	0.629667192697525
56	The girl has something on her head.	The woman has something with her.	1.5547269582748413
57	Microwave would be your best bet.	Your best bet is research.	0.9949904680252075
58	A black and white cow in a pen with hay.	Black and white cows behind a fence.	2.853657305240631
59	Older woman holding newborn baby.	a woman sitting on a sofa holding a baby.	3.336617946624756
60	"The report cites the marriage of the alleged operational commander of the Bali bombings, Mukhlas, to Farida, a ""highly cosmopolitan and well-educated young woman""."	The report cites the marriage of the alleged operational commander of the Bali bombings, Mukhlas, as an example of how JI uses marriage to grow.	3.412788510322571
61	A blonde haired toddler swinging on a tire swing.	A blonde haired child is swinging on a tire swing.	4.568952322006226
62	That's what I believe.	Yes, I believe it's a good idea.	1.3970281183719635
63	"Jeremy's a good guy, Barber said, adding: ""Jeremy is living the dream life of the New York athlete."	"He also said Shockey is ""living the dream life of a New York athlete."	3.1176939606666565
64	A flock of birds hovered over the sandy beach.	Birds are flying at a beach.	3.9513224363327026
65	A group of black people in front of a building with a moped.	A group of people are outside a decrepit building.	2.0870190858840942
66	Dog is jumping down a ramp.	A girls is jumping in the sand.	0.9156568348407745
67	Four children on stools in a diner.	Four children sit on tall bar stools at a yellow and grey bar.	3.53695809841156
68	A woman is slicing garlics.	A woman is slicing an onion.	2.9404380917549133
69	The Sunshine Group LTD represented the developers, The Related Companies and Apollo Real Estate Advisors LP, on the deal.	The developers, The Related Cos. and Apollo Real Estate Advisors, hope sales top $1 billion.	2.886122167110443
70	One white boy and one black boy stand with arms around each other.	Two young boys, one white and one black, are standing with their arms around each other.	4.712724685668945
71	Two black dogs are jumping and playing with a yellow tennis ball in the snow.	A brown dog and a black dog playing with a yellow soccer ball.	2.887183725833893
72	A man is playing a cello.	A man is rapidly lifting small weights.	0.8648723363876343
73	Also it is useful to keep the consistency in your story.	It is important to keep the story in the scope of your limit.	2.9664459824562073
74	Two cats are looking at a window.	A white cat looking out of a window.	3.6681416630744934
75	A person is peeling a potato with a potato peeler.	A man is cutting tomatoes with a cleaver.	0.8323314785957336
76	You don't have to know.	You don't have to do anything to season it.	1.7788606882095337
77	It very much depends on the grant in question.	I think it depends very much on the area.	1.886744499206543
78	The flock of sheep are spread out in the field.	A white cat stands on the floor.	0.03325202967971563
79	Taiwan has attempted to gain observer status to the United Nations-affiliated WHO for seven years, but again was rebuffed March 19 at its annual conference in Geneva.	It has sought observer status for seven years, but was again rebuffed May 19 at the annual WHO conference in Geneva.	4.177586734294891
80	A father napping in a chair with a baby on his lap.	Man with pink shirt sleeping on chair with infant.	3.337649703025818
81	A man is kicking pots of water.	A man is picking flowers.	0.9448231756687164
82	"Contrary to what PeopleSoft management would have you believe, Oracle intends to fully support PeopleSoft customers and products for many years to come."""	"Ellison said that contrary to the contentions of PeopleSoft management, Oracle intends to ""fully support PeopleSoft customers and products"" for many years to come."	4.423892796039581
83	A woman is cutting tofu.	A woman is cutting an onion.	1.4635585248470306
84	An oriental lady is cutting a carrot into thin pieces.	A woman is slicing a carrot.	4.348708987236023
85	Two men are dancing together.	A woman opens a closet.	-0.38116730749607086
86	It rather depends on which country you're in.	That depends on which country you are in.	4.159324765205383
87	A man and woman are posing for the camera.	A cat sitting on sand looking up at the camera.	0.5483993142843246
88	The group is eating while taking in a breathtaking view.	A group of people take a look at an unusual tree.	1.4317478239536285
89	Claudette, the first hurricane of the Atlantic storm season, hit the mid-Texas coast July 15 with 85-mph wind.	Claudette, the first hurricane of the Atlantic storm season, hit the mid-Texas coast July 15, classified as a Category 1 hurricane with maximum sustained winds of 85 mph.	4.7497886419296265
90	Green and white bird perched on tree branch.	Bird with a green head and white chest perched on a tree branch.	4.65084046125412
91	The life expectancy for boys born in 2001 was 74.4 years, up two years since 1990.	According to the report, average life expectancy has increased by nearly two years since 1990.	3.2331863045692444
92	A group of teenagers in red shirts are smiling.	A group of people are wearing orange shirts.	1.9475209712982178
93	Three children wrestle on a floral carpet.	Three children playing on the floor.	3.49778950214386
94	A man is playing a guitar.	A man is playing a keyboard.	1.917864978313446
95	Small child playing with letter P	2 young girls are sitting in front of a bookcase and 1 is reading a book.	0.6594543159008026
96	Let's show we won't let them off, said Marc Blondel, leader of the Force Ouvriere union.	The movement to defend pensions is gaining momentum, and we won't give up, said Marc Blondel, leader of the Force Ouvriere union.	3.3816492557525635
97	Someone is drawing.	Someone is dancing.	0.5018660053610802
98	This is the tip I find most useful:	Something like this is useful:  	2.910909354686737
99	Diana was at her lowest ebb when she wrote the letter to Paul Burrell claiming there was a plot to kill her.	Burrell said Diana wrote a letter in October 1996 claiming there was a plot to kill her in a smash and gave it to him to keep as insurance.	3.0828964710235596
100	A dog running on the grass	Two dogs are running on the grass.	3.955751061439514
101	The train sits at the train station.	A train parked at a train station.	4.032993316650391
102	A bicycle is parked by a shop.	A bicycle is parked outside a bookstore.	3.915054500102997
103	Can you do this?	So, CAN you do this?	4.155130386352539
104	A man is dancing.	A man is thinking.	1.271567940711975
105	The tech-laced Nasdaq Composite Index gained 2.90 points, or 0.18 percent, to 1,606.87.	At 12:10 p.m. EDT, Canada's benchmark S&P/TSX composite index was up 6.87 points or 0.1 per cent to 6,979.29.	2.4213260412216187
106	You got it right.	Yes you got it.	2.681416869163513
107	Aventis, based in Strasbourg, France, is one of a handful of companies that still make the flu vaccine.	Aventis, based in Strasbourg, France, is one of the leading producers of the vaccine and one of a handful of companies that still make it.	4.429848492145538
108	A white dog runs along a rocky shoreline.	A dog jumps over a hurdle.	1.5217237174510956
109	A man is slicing a tomato.	A man is riding a horse.	0.3270241990685463
110	Two men standing in grass staring at a car.	Two women sitting in chairs in a shop.	0.26250027120113373
111	A man is playing his guitar at Joe's Cafe.	The man is playing the drums for his mom.	1.3106346130371094
112	A man and a woman is kissing each other.	A man and a woman are hugging and kissing each other.	4.422353208065033
113	"The agency will ""consider as timely any tax returns or payments due"" Aug. 15 if they are submitted by Aug. 22."	The agency said it would consider as timely any tax returns or payments due from Friday through Aug. 22 if they are completed by Aug. 22.	4.012852907180786
114	You do not need to worry.	You don't have to worry.	4.554659724235535
115	A woman riding a brown horse.	A girl riding a brown horse.	4.35027539730072
116	"A young boy jumping into a pool that says ""no diving""."	A boy jumps into a pool while lifeguards watch.	3.061273992061615
117	A woman is dancing.	A woman plays the clarinet.	1.485065221786499
118	A man is dragging a dead deer.	A man is jumping into water from a cliff.	0.6316457688808441
119	a dog jumps into the water.	A dog is jumping into the water.	4.893600940704346
120	A woman pours a mixture into a bowl and mixes it.	A woman is preparing an egg in a skillet.	1.656513512134552
121	The wood probably isn't rotten, it's just worn out.	It's just worn out and not safe.	1.9928860664367676
122	He is about to run into the boat	The man is getting his boat clean to take it out on the water.	2.7666565775871277
123	Work into it slowly.	You work on it slowly.	4.174138605594635
124	A man is playing a guitar.	A man is singing while playing the guitar.	3.677343428134918
125	A man is playing a ukulele.	A man is sitting and playing a small guitar.	2.2439058125019073
126	Two men are helping a boy.	Two men are with a young child.	3.2144546508789062
127	A man running on a track.	a man running track	4.901748299598694
128	It's not a good idea.	It's a good idea to do both.	1.7857719957828522
129	Special police detained Khodorkovsky early on Saturday in the Siberian city of Novosibirsk, where his plane had made a refuelling stop.	Police detained Khodorkovsky early on Saturday when his jet made a refueling stop in the Siberian city of Novosibirsk.	4.468259215354919
130	In the year-ago period, Pearson posted a 26 million pre-tax profit.	A year ago the firm posted a profit of 26 million pounds.	3.539324700832367
131	Veteran stage and screen actor Hume Cronyn died of cancer Sunday.	Character actor Hume Cronyn, 91, died Sunday at his home in Connecticut.	3.2933002710342407
132	A brown and white dog is running across a brown field.	A person hanging from a rocky cliff.	-0.21927755326032639
133	You PROBABLY don't have any chance at the moment.	"Saying ""thanks, I don't have any questions at the moment."""	1.5392319858074188
134	Downstream at Mount Vernon, the Skagit River was expected to crest at 36 feet -- 8 feet above flood stage -- tonight, Burke said.	The Skagit was expected to crest during the night at 38 feet at Mount Vernon, 10 feet above flood stage, the National Weather Service said.	3.666244149208069
135	You might have to try a variety before you find one that clicks with him.	My advice would be to try a variety of coffees that you can afford and find one you like.	1.3984665274620056
136	Shares of Corixa fell 12 cents to $6.88 on the Nasdaq stock market.	Corixa's stock barely flinched on the news, dipping 12 cents to close at $6.88.	3.593837022781372
137	A woman in a black and orange jacket throws a stick for a brown and black dog to fetch.	The man in a blue jacket is standing in a crowd.	0.2009538933634758
138	A woman is climbing a cliff.	A woman is climbing a rock face.	3.399623930454254
139	A man wearing black formal wear & a black top hat is riding a white show horse.	A man with a top hat riding a white horse.	4.229967296123505
140	A young laughing girl and a boy are playing on a big drum.	A baby girl and little boy are standing next to a guitar and a drum.	3.2131698727607727
141	Canada is a small country, and it needs companies like this, deals like this.	"A passionate nationalist, Mr. D'Alessandro said: ""Canada is a small country, and we need more companies like this."""	3.015264868736267
142	In so many different ways, the artistry of black musicians has conveyed the experience of black Americans throughout our history, Bush said.	Surrounded by singers from Harlem, Bush said: ''The artistry of black musicians has conveyed the experience of black Americans throughout our history.	4.484683275222778
143	A woman is slicing some tomatoes.	A woman is chopping a potato.	1.6809824109077454
144	Two Indian women with two Indian girls near the water.	Two Indian woman stand with two Indian girls on a beach.	3.912981152534485
145	I was in a similar situation.	I am in a similar situation.	4.284754395484924
146	It later emerged that he had broken his right thigh and bones in his right wrist and elbow.	Tour doctors later confirmed that he had broken his right leg near the hip and also sustained wrist and elbow fractures.	3.894316554069519
147	A yellow school bus parked in a field.	A brown horse in a green field.	1.007441207766533
148	A car is driven down the road.	A girl is walking down a road.	2.990298867225647
149	"The workers accuse General Dynamics of ""reverse age discrimination"" because of a change in retirement benefits in 1997."	General Dynamics was sued when it changed its retirement benefits in 1997.	3.42832088470459
150	The boy also sprayed the room full of retardant from fire extinguishers, which made it hard to see, the chief said.	The boy fired once into a wall and sprayed the room with fire extinguishers, making it hard to see, the chief said.	4.2262303829193115
151	The man is exercising.	A man is doing pull-ups.	2.660161256790161
152	A woman is taking a bath.	A woman is riding a horse.	1.184862107038498
153	A car is pulling off the side of the road onto the street.	A silver car parked on the side of the road in front of the hills.	2.8274935483932495
154	Three women cook.	Two women cooking.	3.317239284515381
155	So think it in this way.	Think of it this way.	3.958531618118286
157	A person is playing a piano.	A person is slicing a potato.	0.7471510767936707
158	A group of male construction workers repair railroad tracks on a cloudy day	A crew of workers working on a railroad track.	3.1424736976623535
159	Men are playing soccer.	Two teams play soccer.	3.3959555625915527
160	A girl is coming up on a car.	A girl jumps on top of a car.	3.867082893848419
161	A guy is taking off his sunglasses.	A boy is removing his sunglasses.	4.023323655128479
162	Two boys playing a game of flag football.	Two boys are playing flag football.	4.871614575386047
163	You should do it.	You should never do it.	2.658781409263611
164	There's not a lot you can do about that.	I really do not think there is much you can do about that.	4.096853733062744
165	Ten people riding ATVs.	4 people are riding bikes	1.3842490315437317
166	The man is mixing whipping cream.	The man is holding a skunk.	0.20333828404545784
167	Two black dogs are playing on the grass.	Two black dogs are playing in a grassy plain.	4.476185441017151
168	A female DJ holds up a Michael Jackson album.	a girl holding a picture of Michael Jackson smiling	2.750784754753113
169	Two puppies playing with a plastic bag.	Two dogs playing in a yard.	2.6856055855751038
170	A young woman is putting stickers all over her face.	A woman is applying stickers to her face.	4.4676074385643005
171	He also reaffirmed his wish to resolve the North Korean nuclear crisis peacefully.	But the North Korean nuclear crisis has dominated his time in office.	2.310030311346054
172	A small boy is building with some wooden blocks.	A small boy wearing a blue shirt stacks wooden blocks.	3.8781091570854187
173	National Breast Cancer Centre chief executive Professor Christine Ewan said it was too early to quantify the risk to women.	National Breast Cancer Centre head Professor Christine Ewan said there was no need for panic.	2.2808820009231567
174	A group of people are dancing.	Women are dancing outside.	3.379414677619934
175	Unfortunately, this question cannot be answered in its full generality.	This cannot be answered in general.	3.8192546367645264
176	You answered your own question.	You pretty much answered your own question.	4.317083358764648
177	A person is slicing some garlic.	A person is dicing a clove of garlic with a knife.	3.9474934339523315
178	The answer to this and all such similar questions is in two stages:	The answer to both questions is: Yes.	2.4330872297286987
179	It depends on what you want to do next, and where you want to do it.	It depends on what you want to achieve.	3.363337814807892
180	Many football players sitting on the ground.	A dog rolls on the ground.	0.6723503023386002
181	Klarman was arrested by FBI agents in the Hamptons, an exclusive summer resort enclave east of New York City.	Klarman was arrested by FBI agents Monday morning at his home in New York.	3.200509548187256
182	I think it's just a habit.	I think it's a bad idea.	1.7431527376174927
183	This a picture of the countryside with a large city in the background.	There are some black cattle in a grassy plain with a large tree in the background.	0.8467990159988403
184	It depends entirely on your company and your contract.	It depends on your company.	4.429185688495636
185	The three grocery chains were relying on store managers and replacement workers to keep their stores open.	The supermarket chains have used managers and replacement workers to keep their stores open, often at reduced hours.	3.536371886730194
186	The research firm earlier had forecast an increase of 4.9 percent.	The firm had predicted earlier this year a 4.9 percent increase.	4.4004130363464355
187	The best thing you can do is to know your stuff.	The best thing to do is to overcome the fussiness.	1.249048113822937
188	It depends on what you want to have in your tank.	i think it depends what you want:	1.7078515887260437
189	"Ms Lafferty's lawyer, Thomas Ezzell, told a Kentucky newspaper: ""My understanding of this is that there is a lower percentage of successful impregnations with frozen."	My understanding of this is that there is a lower percentage of successful impregnations with frozen, Ezzell said.	4.466233253479004
190	Two dogs play in the grass.	Two tan dogs play in the snow.	2.8623589873313904
191	Two men standing in grass staring at a car.	A woman in a pink top posing with beer.	-0.07165789604187012
192	The benchmark 10-year Treasury note yield <US10YT=RR> dipped below 4.20 percent on Tuesday.	Prices for Treasury securities also rose, with the yield on the benchmark 10-year note falling to 4.19 percent.	3.287106454372406
193	Parrot pushing a small shopping cart.	A white bird is steering a shopping cart.	3.5231608152389526
194	Several kids jump up and down on a trampoline.	A man is doing back flips on a trampoline.	2.6293930411338806
195	The woman in overalls paints a picture for her wall.	A woman is painting her wall white.	3.4371143579483032
196	Child holding an object that is on fire.	A child in pink holds an object that appears to be on fire.	4.167432188987732
197	A woman in a plaid outfit is looking through a bag of produce.	This is the picture of a woman in a flowered dress, toting something in a bucket.	1.5580478310585022
198	She was the only woman in her unit and a member of Teamsters Local 995.	She was the only woman employed as a warehouse worker and heavy equipment operator and the only woman in her Teamsters local.	3.407455086708069
199	A man breaks cinder blocks on another man.	A woman breaks an egg into a pan.	0.890653133392334
200	There is a cook preparing food.	A cook is making food.	4.749566316604614
201	It depends on how it's used.	It depends on how long it's been out.	2.943752408027649
