id	sentence1	sentence2	score
202	You have to decide what you want to get out of this.	You have to find out what works for you.	1.842454969882965
203	A wet child enjoys the summer.	A woman is enjoying the summer weather.	3.0991774797439575
204	A surfer is riding on a breaking wave.	a group of surfers catching a wave	3.160771429538727
205	Two dogs running on the shore.	A white dog running on the beach.	2.7523332834243774
206	On the cell's surface, the foreign components are recognised by other cells that then realise it is infected and kill it.	The foreign bits are recognized by other cells that realize it is infected and kill it.	4.4347599148750305
207	I don't see why there should be any problem with this whatsoever.	I don't see why this could be a problem.	3.72809499502182
208	A couple is playing the game of Life.	The family is playing a game together.	2.634819447994232
209	A cat is walking around a house.	A woman is peeling potato.	0.2006201073527336
210	Two men are fistfighting in a ring.	Two men fistfight in a ring.	4.664594531059265
211	A man in a white shirt and hat playing a guitar.	A man in a green shirt and black hat playing a guitar on stage.	2.953435480594635
212	A man in a wet suit is throwing a baby wearing a wet suit up into the air.	A man in a white print shirt and a woman in a black dress dancing.	1.2015387415885925
213	Kollar-Kotelly has scheduled another antitrust settlement compliance hearing for January.	The judge scheduled another oversight hearing for late January.	3.181934356689453
214	You should do it.	You should do what it says.	3.396329879760742
215	Several people on motorcycles in a market square.	People on motorbikes in a city street.	3.0847948789596558
216	A man is singing while playing the guitar.	A man is stuffing himself full with food.	0.6326498091220856
217	Two animals sitting on a rock.	The brown train is sitting on the railroad tracks.	0.3417034447193146
218	New legit download service launches with PC users in mind.	BuyMusic is the first subscription-free paid download music service for PC users.	2.4097485840320587
219	A orange and white cat laying on a blanket in a black leather chair.	A ginger and white cat curled up and asleep on a leather chair.	3.8218989968299866
220	It really doesn't matter.	It doesn't matter unless it is really far off.	2.8961187601089478
221	You are on the right path.	You are right on the mark.	2.437291443347931
222	A man uses a chainsaw to sculpt a phallic ice sculpture.	A man is using a chainsaw to carve a wooden sculpture.	3.7812209129333496
223	A man eats popcorn while watching cartoons late one night.	A man and a girl are watching cartoons at home	2.151620090007782
224	A person is drawing on a large touchscreen.	A man is drawing on a digital dry erase board.	2.2559401392936707
225	Wal-Mart, Kohl's Corp., Family Dollar Stores Inc., and Big Lots Inc. were among the merchants posting May sales that fell below Wall Street's modest expectations.	Wal- Mart, Kohl's Corp., Family Dollar Stores Inc., and Big Lots Inc. posted May sales that fell below Wall Street's modest expectations.	4.8161837458610535
226	Two men talking in front of a plane.	Two men talking in front of a small plane.	4.907181262969971
227	A yellow car speeds along a snowy field.	A yellow car drives quickly in the snow.	4.444084465503693
228	A man plays a trumpet.	A man is playing the trumpet.	4.941686689853668
229	I don't think it makes any tremendous difference.	I don't think it makes much difference.	4.616492390632629
230	A boy in red jumping into a sandbox.	A dog swimming in a pond	-0.17701193690299988
231	A child is waking up.	A girl is waking up.	4.197267293930054
232	It depends on what you want to do next, and where you want to do it.	It depends on what and where you are going to do.	3.3945506811141968
233	You just have to base your answer on what you do know, which is what you want.	They can, but the way to do it depends on what you have available.	0.42011313140392303
234	A woman is sitting in the water.	The woman is skating in the park.	1.0683006793260574
235	There are a few things I think you should do.	There are a few things I don't understand:	0.840129554271698
236	A boy climbs a forest hill.	A boy is climbing a hill.	3.8945788145065308
237	A skunk is looking here and there.	A skunk looks at the camera.	3.9435601234436035
238	Mr McDonnell is leading Grant Thornton International's inquiry into the Italian business.	Mr McDonnell wants to establish if the Italian business followed Grant Thornton's audit procedures.	3.7598294019699097
240	You just have to base your answer on what you do know, which is what you want.	Remember this is your degree we are talking about, its up to you what you want to do.	2.0032207667827606
241	I have the same thing.	I have had the same problem.	3.5684221982955933
242	"My answer to your question is ""Probably Not""."	I think that the short  answer to your question is: No.	2.492839992046356
243	It's not a good idea.	It's not just a good idea, it's an excellent idea.	3.7482476234436035
244	A black and white photo of a love seat.	Black and white photo of couch with purse at one end.	2.032550573348999
245	A woman and man are dancing in the rain.	A man and woman are dancing in rain.	4.954274892807007
246	It's not a good idea.	It is not a good idea.	4.791931509971619
247	Someone is playing a piano.	Someone is playing guitar.	1.9286388158798218
248	I was in a similar situation.	Personally when I was in a similar situation I sent the couple a card and a gift.	1.4302735030651093
249	A white bird with long orange legs standing by a lake.	Large white bird with long orange beak standing on the shoreline.	4.061223268508911
250	The man is playing the guitar.	The man is peeling a potato.	0.27474546805024147
251	Two cats sitting on a couch looking out the window.	Two cats are looking at a window.	4.4356536865234375
252	A black and white dog is jumping into the water.	a white dog runs across the water.	2.9596853256225586
253	Sayliyah was the command base for the Iraq war, but Central Command sent hundreds who ran the war back home to Tampa, Florida.	As Sayliyah was the command base for the Iraq war, but hundreds who ran the war have returned to the United States.	3.7550216913223267
254	A person is boiling noodles.	A cat is licking a bottle.	0.18937693908810616
255	You just have to base your answer on what you do know, which is what you want.	You may want it, but the process given to you is what you have to work within.	1.4894217252731323
256	There are a few things you can do: 	There are a few things I think you should do.	3.0795422196388245
257	A man sleeps with a baby in his lap.	A man asleep in a chair holding a baby.	3.528478443622589
258	Yes, there is a chemical difference.	Yes, there is a reason for it.	0.8590666204690933
259	A man reels in a fish.	A woman is pouring oil in a bowl.	0.24960089474916458
260	Blue and red plane in mid-air flight.	a blue and red airplane while in flight.	4.394230246543884
261	"The best the investigators can do is nitpick about the process and substance of isolated business decisions ... and question his competence as a manager."""	"Ebbers' lawyer, Reid Weingarten, said despite the thorough investigation, ""the best the investigators can do is nitpick about the process and substance of isolated business decisions."""	3.303966224193573
262	We need to change old habits and seriously rethink business-as-usual.	"He urged employees to ""avoid complacency"" and to ""change old habits and seriously rethink business-as-usual."""	3.580591380596161
263	A yellow vested person is doing road work.	A person is doing very well on their skateboard.	1.05725958943367
264	A person is putting shredded cheese in a pot.	A hamster is eating some seeds.	0.2447262406349182
265	A man is playing a piano.	A guy is peeling a potato.	0.8044039458036423
266	If you are not sure how to do it, don't do it at all.	If not, don't do that and spend that time with something you like to do.	1.7376849055290222
267	People making a structure out of cards.	Two people are together and one is using a piece of clothing in a different way than intended.	0.8595604449510574
268	The coffee simply picks up the aluminum from the pot, as the coffee is acidic.	One idea is cleaning the coffee residue from the coffee pot.	2.5687378644943237
269	A man in a suit dances with a young girl in front of an audience.	A women dangles from a blue fabric connected to a tree.	-0.03450102638453245
270	But HRT should not be used to prevent heart disease or any other chronic condition.	The clear message is it should not be used to prevent cardiovascular disease, Manson said.	3.344089090824127
271	The baby boy wants his mother.	A baby boy is happy to see his mother.	3.403843641281128
272	Girl playing in a puddle with her bare feet.	A child is playing with two white and black geese.	0.436149537563324
273	I had the same problem as you.	I have just had the same problem.	3.748401403427124
274	A person is slicing onions.	Someone is slicing an onion.	4.695066809654236
275	It probably depends on the cut of meat.	It depends on the meat and how it's cut.	4.8420339822769165
276	Yes, you have to file a tax return in Canada.	You are not required to file a tax return in Canada if you have no taxable income.	3.7120473384857178
277	This is not a good idea.	But it is not a good idea.	4.165095388889313
278	Two kids are swimming.	Six kids are going swimming.	3.598485589027405
279	Geraldine Andrews, the pastor's daughter-in-law, said Robinson recently took her daughter out of a mental health facility.	Geraldine Andrews, Reynolds' daughter-in-law and a friend of Wilson's family, said Robinson had recently taken Wilson out of a mental health facility.	4.0126460790634155
280	A man is driving a car.	A man is riding a horse.	0.9526203572750092
281	It's pretty much up to you.	It's much better to ask.	1.729360967874527
282	A man is seasoning some carrots.	A woman is slicing garlic.	0.7308221608400345
283	A woman is dancing.	A woman is playing violin.	1.9539424777030945
284	Shortly after the opening bell, the Dow Jones Industrial Average was up 11.13 to 9,228.48, while the S&P 500 index gained 1.74 to 982.33.	After a weak start, the Dow Jones Industrial Average ended the day up 26.26 to 9,217.35, while the S&P 500 index rose 3 to 980.59.	2.8140324354171753
285	You need to read a lot to know what you like and what you don't.	Yes, you should create a portfolio site to showcase what you can do and what you've done.	0.9219320863485336
286	I'm going to go out on a limb here...	I'm going to be very direct here.	1.680111289024353
287	A man is demonstrating how to work with clay while at least two people observe.	At least one of the three women is talking to the others.	0.5158603191375732
288	One boy is pushing another boy on a swing.	A boy is pushing another boy on the swings.	4.705437421798706
289	That is your problem, not your supervisor's.	Work with your supervisor and your team to solve the problem.	2.575705647468567
290	A man riding on the back of an orange SUV.	an African man hanging onto the back of a very full yellow van.	2.285933196544647
291	Swimmers are racing in a lake.	Women swimmers are diving in from the starting platform.	2.438734769821167
292	SCO says the pricing terms for a license will not be announced for weeks.	Details on pricing will be announced within a few weeks, McBride said.	2.4836409091949463
293	A white dog with light brown markings has a stick in his mouth and his paws in the snow.	A white dog holds a stick in its mouth while it runs through snow.	4.266030788421631
294	A man is preparing a snake for cooking.	The man is dropping sliced cucumbers into water.	1.0648292303085327
295	In the United States, 20.7 percent of all women smoke.	Nevada is where the most women smoke, 28 percent.	3.110496401786804
296	A group of people are wearing police uniforms conducting an arrest.	A group of police officers are wearing protection.	3.3328819274902344
297	In morning trading, the Dow Jones industrial average was up 40.12, or 0.5 percent, at 8,571.69, having fallen 51 points Monday.	In New York, the Dow Jones industrial average a gauge of 30 blue chip stocks was up 3.29 points or 0.04 per cent to 8,585.97.	1.4819498360157013
298	A man is picking up a tree.	A man is carrying a tree.	3.918534517288208
299	A black dog standing in a grassy area.	A long-haired dog stands in a grassy wooded area.	3.277275264263153
300	Saddam is gone, but we want the (U.S.) occupation to end, said Hit resident Abu Qasim.	Saddam is gone, but we want the (U.S.) occupation to end.	4.118555784225464
301	Yes, there is a rule against this.	There's no rule against it.	3.256083130836487
302	A cat gets stuck on a moving ceiling fan.	A cat is swinging on a fan.	3.588334023952484
303	An elderly man works on his laptop at home.	Older gentleman sitting on couch with laptop.	3.4707528352737427
304	Two women walk down the sidewalk to the store.	Two women walk down the sidewalk in the afternoon.	3.206172287464142
305	A man is dancing.	A woman is exercising.	0.9023883938789368
306	A group of people are sweeping water out of a house.	People are sweeping water out of a house.	4.8497796058654785
307	Two skiing people are doing cross country skiing.	People skiing cross country.	4.497950077056885
308	A cat cleans itself.	A cat is licking itself.	3.353390693664551
309	A machine is sharpening a pencil.	The machine shaved the end of the pencil.	3.6475348472595215
310	You don't have to know.	Other than that you don't have a tax issue.	1.5751397609710693
311	A train is moving.	A man is doing yoga.	0.1963726058602333
312	Results from No. 2 U.S. soft drink maker PepsiCo Inc. (nyse: PEP - news - people) were likely to be in the spotlight.	Wall Street was also waiting for aluminum maker Alcoa Inc. (nyse: PEP - news - people) to report earnings after the close.	1.8859818577766418
313	It depends on what you want to do next, and where you want to do it.	It depends on what you want to say/imply.	1.650376319885254
314	The man is eating.	A man is eating food.	4.716612994670868
315	One person wields an umbrella.	One person is holding an umbrella.	4.647637903690338
316	PeopleSoft will commit $863 million in cash and issue 52.6 million new shares, the companies said.	The new deal would be valued at $1.75 billion, including $863 million in cash and 52.6 million PeopleSoft shares.	4.1359686851501465
317	The answer to both questions is: Yes.	To directly answer the two questions in your title.	1.9072306156158447
318	A man is riding a motorcycle.	A woman is riding a horse.	0.8532921969890594
319	a man and woman walking past a record shop	A man and woman kissing in front of a crowd of people.	1.3175508379936218
320	The respected medical journal Lancet has called for a complete ban on tobacco in the United Kingdom.	A leading U.K. medical journal called Friday for a complete ban on tobacco, prompting outrage from smokers' groups.	3.5669827461242676
321	Bolivia's army fought to stop columns of protesters from streaming into the food-starved capital on Wednesday as a popular uprising against the president spread.	Bolivia's army fought to stop a column of dynamite-wielding miners from streaming into the besieged capital on Wednesday, leaving two dead as a popular uprising against the President spread.	4.045790135860443
322	It has a margin of error of plus or minus 4 percentage points.	That poll had 712 likely voters and sampling error of plus or minus 3.7 percentage points.	1.5589156746864319
323	A red haired women in black is posing for a man while resting on a tree.	A man in a black shirt is holding a child wearing sunglasses.	0.7352817058563232
324	You don't need to know everything.	They just don't want you to know it.	2.433668226003647
325	A man is kicking a soccer ball.	A man is performing tricks with a soccer ball.	3.911559581756592
326	There are three options:	There are only three options:	4.25934374332428
327	A wet, blond dog carries a stick on the shore.	The wet, brown dog has a stick in his mouth and is running in the sand next to the water.	3.1215593218803406
328	Three young women standing in a room together.	Three dark haired young women in white, red and black sweaters.	3.41543972492218
329	A man is doing exercise.	A man is firing a rifle.	0.5696679651737213
330	The Nasdaq Composite Index rose 19.67, or 1.3 percent, to 1523.71, its highest since June 18.	The S&P 500 had climbed 16 percent since its March low and yesterday closed at its highest since Dec. 2.	1.5596455335617065
331	A little girl peddling a scooter.	A girl is riding a scooter.	4.443518221378326
332	A person is on a baseball team.	A person is playing basketball on a team.	2.0401161909103394
333	A man is playing a flute.	A man is riding a scooter.	0.7335616648197174
334	A group of dark-skinned people are walking past barbed wire.	Two women are gossiping by a fence.	1.068490445613861
335	A man is slicing open a fish.	A man is cutting up a fish.	4.378155469894409
336	I'd say it primarily depends on two things:	I'd say it depends on the ultimate outcome you want?	2.573401927947998
337	A man is playing guitar.	A boy is talking to a giant dog.	-0.34813500940799713
338	A man has his son on his back	A man spent his time with his son.	3.566608726978302
339	I think it is great that you had a test conducted.	I think that's a great plan.	1.5886810421943665
340	A human riding a skateboard.	A child is riding a skateboard.	4.269926846027374
341	You burn more Calories digesting protein than you do carbohydrates and fat.	The more you sweat, the faster you will burn calories and fat.	2.144422233104706
342	Electronic Data Systems Corp. Thursday said the Securities and Exchange Commission has asked the company for documents related to its large contract with the U.S. Navy.	In a regulatory filing, EDS said the SEC had asked for information related to its troubled IT outsourcing contract with the US Navy.	3.393835425376892
343	The single currency rose as far as 135.13 yen , matching a record high hit shortly after the euro's launch in January 1999.	The single currency rose as far as 135.26 yen , its highest level since the introduction of the single currency in January 1999.	4.273443818092346
344	Moffitt said the results need to be replicated in another study before testing of individuals for presence of the long or short versions of the gene will be pursued.	Professor Moffitt said the results needed to be replicated before pursuing testing of individuals for the presence of the long or short versions of the gene.	4.625703990459442
345	The two boys are playing kick ball back and forth to each other.	The players are kicking each other while attempting to kick the ball.	3.2133638858795166
346	It depends on what you want to do next, and where you want to do it.	It depends on what you want to be able to do.	3.1880611181259155
347	A table is set with wine and dishes for two people.	A wooden table is set with candles, wine, and a purple plastic bowl.	2.7993470430374146
348	A person wipes butter on a tray.	A person is buttering a tray.	4.109621644020081
349	People are waiting for the fireworks to start.	Three people are waiting for the rain to stop.	2.2042351961135864
350	Martin, 58, will be freed today after serving two thirds of his five-year sentence for the manslaughter of 16-year-old Fred Barras.	Martin served two thirds of a five-year sentence for the manslaughter of Barras and for wounding Fearon.	3.696078360080719
351	Group of people posing with two men dressed as Elvis.	A group of people standing with two other people dressed as Elvis.	4.342785179615021
352	Yes, you should make a résumé.	Yes, you should talk to your professor.	2.0402687788009644
353	The dog is chasing the geese.	One dog is chasing the other.	3.044078052043915
354	A man is slicing a tomato.	A man is slicing a bun.	1.3864658772945404
355	Boy and white dog running in grassy field	A boy and a dog running on grass	4.2724281549453735
356	A woman peels garlic with her hands.	The woman is slicing herbs.	2.310701459646225
357	The new sensor -- dubbed CANARY for ''cellular analysis and notification of antigen risks and yields'' -- hijacks this natural process with two important changes.	The team has named the sensor Canary, for cellular analysis and notification of antigen risks and yields.	3.995252847671509
358	Three children playing in snow.	Three children playing in hay	3.3733975887298584
359	Two men are playing football.	Two men are practicing football.	4.102256596088409
360	It's not a good idea.	No, it's not a good thing.	3.21108341217041
361	A man with a gray beard is being shaved in front of a lecture hall	A man with a beard is sitting in the grass.	2.3429694771766663
362	A woman is spreading mustard on a bread roll.	A kitten is playing with a woman's finger.	0.11744095012545586
363	Gov. Linda Lingle and members of her staff were at the Navy base and watched the launch.	Gov. Linda Lingle and other dignitaries are scheduled to be at the base to watch the launch.	4.004111588001251
364	A black and white dog runs through the water.	Black and brown dog runs through field.	2.6515671610832214
365	Zombies parading around eating brains.	The zombies are eating flesh together.	3.8621002435684204
366	It depends on what you want to have in your tank.	It depends on what you want to achieve.	1.423037052154541
367	A grey cat lying on a wooden table.	A grey cat laying on a dining table.	4.389554262161255
368	Three people sit at a picnic table outside of a building painted like a union jack.	Three people sit at an outdoor table in front of a building painted like the Union Jack.	4.321931898593903
369	A boy is playing violin on stage.	A person is mixing a pot.	0.23537572473287582
370	A man is reading an email.	A person opening a banana.	0.39893604815006256
371	Two ducks are standing by the water.	The birds are swimming in the water.	2.2540462017059326
372	Rich media doubled its share, increasing from 3% in Q2 2002 to 6% in Q2 2003.	Rich Media interactive ad formats doubled their share from 3% in second quarter of 2002, to 6% in the second quarter of 2003.	4.297198057174683
373	A little boy and a little girl playing together outside.	A woman wearing a white shirt stands on the street.	0.24661798030138016
374	The dollar was at 117.85 yen against the Japanese currency, up 0.1 percent.	Against the Swiss franc the dollar was at 1.3289 francs, up 0.5 percent on the day.	1.863507479429245
375	The civilian unemployment rate improved marginally last month -- slipping to 6.1 percent -- even as companies slashed payrolls by 93,000.	The civilian unemployment rate improved marginally last month _ sliding down to 6.1 percent _ as companies slashed payrolls by 93,000 amid continuing mixed signals about the nation's economic health.	4.670583009719849
376	Someone touched the kitten chewing on a string.	Someone is cutting paper.	0.10087918490171432
377	A man is peeling a potato.	A man is slicing a potato.	3.916221857070923
378	A small camouflaged airplane parked in the grass.	A small dog wearing a pink shirt tied to a railing.	0.7434053719043732
379	The next court session will be when the three-judge tribunal announces its verdict in mid-February.	The court's three-judge tribunal was expected to give its verdict next February.	4.533798098564148
380	A person wearing a helmet rides a bike near a white structure.	A girl wearing black shorts and boots is standing next to a blue motorcycle.	1.479787528514862
381	Motorcycle parked next to a car outside.	A motorcycle parked next to a car.	4.822061657905579
382	A cat sleeping on the coach with a pillow behind it.	The cat is laying on an animal print blanket.	2.673428952693939
383	A woman is cutting onions.	A woman is cutting tofu.	1.5993382036685944
384	I'd say it primarily depends on two things:	I'd say it depends what conditions you have.	2.7713555097579956
385	The Space Infrared Telescope Facility's mission is to search for the beginnings of the universe.	NASA is scheduled to launch the Space Infrared Telescope Facility on Monday morning.	2.573409676551819
386	Tan cows look closely at the camera.	A white and grey cat in a bathroom sink looking at the camera.	0.6920232623815536
387	It is about a third of what I owe in the world, he told reporters.	It ain't coming to me, but it's only about a third of what I owe in the world.	3.6118829250335693
388	The black and white dog has its mouth wide open.	A black and white dog jumps in the snow.	2.1162688732147217
389	A steam engine and train moving toward the camera.	A white sheep on a hillside looking at the camera.	1.1837273836135864
390	Two motorbikes racing on a dirt course.	two motorbikes on a dirt track.	4.461970627307892
391	I think you're looking for Mikey (1992).	I think you're looking for the movie	1.9194966554641724
392	The children are holding musical instruments.	A group of children are singing and playing instruments	3.7064412236213684
393	You don't need any visa.	You don't have to worry.	1.7374026775360107
394	A dog has a sweater on.	A man in a suit jacket is sitting on a red couch with a cat.	1.1523519456386566
395	A woman is cracking eggs.	A man is talking to a woman.	0.45732658356428146
396	But in the first 30 seconds after Young entered the ring, the family knew it was an uneven match, Meyers said.	But in the first 30 seconds of the bout, family members knew it was an uneven match, Jodie Meyers, Stacy Young's sister, said.	3.8231825828552246
397	Older gentleman looking at red motorcycle.	A man looking at a red motorcycle.	4.447416663169861
398	the men are about to score in a water polo tournament	The two men are about to compete in a match.	2.466702163219452
399	You have a problem.	This is a big problem.	2.7278003096580505
400	There are a few things you can do: 	There are a few minimally-effective things you can do at the personal level.	2.3759523034095764
