id	sentence1	sentence2	score
401	Last week, his lawyers asked Gov. Mark R. Warner to grant clemency, but the governor declined to intervene.	Last week, his lawyers asked Warner to grant clemency under certain conditions that would have lead to a new sentencing hearing.	3.4835833311080933
402	The bishop told police he thought he had hit a dog or a cat or that someone had thrown a rock at his vehicle.	Bishop O'Brien, aged 67, had told police he thought he had hit a dog or cat.	3.5153937339782715
403	The man is sitting cross legged wearing a cloak and holding a stick.	Man sitting cross legged while wearing a brown cloth and holding a wooden stick.	3.7024396657943726
404	That compares with a profit of $1 million, or breakeven, on $1.39 billion in revenue during the same period last year.	Total revenue for the second quarter was $1.48 billion, up 7% from $1.39 billion in the same period last year.	2.6612451672554016
405	The kids are at the theater watching a movie.	it is picture day for the boys	0.7351341843605042
406	The small dog is wearing a sweater and looking up at the camera.	A small white dog wearing a jacket looks up at the camera.	3.623824715614319
407	It was developed with consultation from more than 300 leaders in academia, industry, government and the public.	The plan, called The NIH Roadmap, was developed over 14 months with help from more than 300 consultants in industry and academia.	2.9114755988121033
408	In the US, it will depend on the school.	This will depend on the university.	3.855941891670227
409	A black dog stands next to materials at a construction site.	A black dog stands in the middle of a construction site.	4.351692199707031
410	A television, upholstered chair, and coffee stable in a bright room.	A leather couch and wooden table in a living room.	1.9122177362442017
411	A dog swims through the water.	A dog wearing a cape is running through the snow.	1.626259684562683
412	A New Castle County woman has become the first Delaware patient to contract the West Nile virus this year, the state's Department of Health reported.	A 62-year-old West Babylon man has contracted the West Nile virus, the first human case in Suffolk County this year, according to the county health department.	3.642961084842682
413	The child's bike got wet.	She is putting away the bike.	2.6352745294570923
414	In addition to O'Connor, Rehnquist's majority opinion was joined by Justices David Souter, Ruth Bader Ginsburg, and Stephen Breyer.	Joining him in the majority opinion were Justices Sandra Day O'Connor, David H. Souter, Ruth Bader Ginsburg and Stephen G. Breyer.	4.3883538246154785
415	I've had this same problem.	I had this same problem.	4.701737761497498
416	No it does not affect your ratings.	No it is not.	0.2702159434556961
417	The Bush administration blames Hussein loyalists and foreign Muslim militants who have entered Iraq to fight U.S. troops for the wave of bombings and guerrilla attacks.	The Bush administration blames the wave of bombings and guerrilla attacks on Saddam loyalists and foreign Muslim militants who have entered Iraq to fight U.S. troops.	4.739950895309448
418	A chimp is kicking a target.	A woman is putting oil into a skillet.	0.010437322780489922
419	A man dressed in a pale scarf with a stick.	A runner is resting in the shade with a bottle of soda.	1.1458976566791534
420	A black dog looking at the camera.	The black and white bull is looking at the camera.	2.9492712020874023
421	You need to add this to your resume because it is the only position you have had.	This gives you the opportunity to make your case that you really do have expertise in XXX.	1.2795981764793396
422	The cat is licking a bottle.	A cat plays with a small bottle.	3.588436245918274
423	The girl has a driver's license	A man has a driver's license.	3.278859853744507
424	Two women sitting outside laughing.	Two women standing outside of a bus.	1.8791739642620087
425	The woman is wearing yellow.	The woman is wearing red.	1.877857893705368
426	You just have to base your answer on what you do know, which is what you want.	Yes, you can do exactly what you want to do.	2.08657443523407
427	Dennehy, who transferred to Baylor last year after getting kicked off the University of New Mexico Lobos for temper tantrums, had begun to read the Bible daily.	Dennehy, who transferred to Baylor last year after getting kicked off the University of New Mexico Lobos for temper tantrums, became a born-again Christian in June 2002.	3.1656816601753235
428	It is impossible to answer this question without a form check.	This is a part answer to your question	0.9858930855989456
429	Two dogs are running through the grass near a house and trees.	Two dogs are running through a green yard	3.5861659049987793
430	A kid sits on a soccer ball outside.	A kid sitting on a soccer ball at the park.	4.434555768966675
431	You are on the right path.	You're on the right path.	4.793158769607544
432	two cats, one brown and one white laying on a bed with a blue blanket.	Two cats, one ginger, the other white laying on a bed.	3.8206255435943604
433	Initial autopsy reports show they died of dehydration, hyperthermia and suffocation.	Two more died later, and initial autopsy reports show they succumbed to dehydration, hypothermia and suffocation.	4.23860490322113
434	A woman is about to paint.	A boy is about to take a picture.	0.7027630507946014
435	You just have to base your answer on what you do know, which is what you want.	Th answer to you problem is that you dont actually know what you're getting in .	2.258773297071457
436	A man is standing in front of the window and looking outside.	A man is staring out the window.	3.8747569918632507
437	A cat plays in his water.	The cat fished a straw out ouf his water dish.	3.3900031447410583
438	The technology-laced Nasdaq Composite Index .IXIC shed 15 points, or 0.98 percent, to 1,492.	The broader Standard & Poor's 500 Index <.SPX> edged down 9 points, or 0.98 percent, to 921.	1.5204605460166931
439	A man holding a cat.	A man holding a dog.	2.4257032573223114
440	There are two things to consider:	A couple things to consider:	3.981183171272278
441	State health officials said today a young northeast Kansas woman likely has the state's first case of monkeypox among humans or animals.	Health officials confirmed today that a northeast Kansas woman has the state's first case of monkeypox and the first case west of the Mississippi River.	4.062690734863281
442	He refused to reveal what percentage of flights carried sky marshals, or whether they would be increased.	He refused to say what percentage of domestic flights had security officers on board.	3.268395960330963
443	A black dog is jumping out of water.	A black dog is shaking off water.	3.858644664287567
444	The brown dog runs on the snow with a white ball in his mouth.	Four dogs play in the snow with the city skyline behind them.	2.4381238222122192
445	A man attacks a woman.	A man slaps a woman.	3.593282103538513
446	Two zebras play in an open field.	Two zebras are playing in a field.	4.788837730884552
447	I have few suggestions for you:	I have two suggestions for you:	4.125547707080841
448	Two workers are sitting next to pipes eating lunch	The construction workers are sitting down to eat lunch.	3.4258881211280823
449	Chaudhry was released 56 days later and the Fiji military installed an all-indigenous government led by Qarase, who won democratic elections in September 2001.	The Fijian military installed an all-indigenous government led by Mr Qarase, who won democratic elections in September 2001.	4.2799317836761475
450	How do you do that?	How to do that?	4.387071132659912
451	A woman is riding a horse.	A man rides a horse.	3.7508147954940796
452	Six children are cleaning a room.	Two male children cleaning up leaves in a parking lot.	2.2663940489292145
453	A man in a brown coat rubs his nose.	A bald man with a red beard holds his hand near his mouth.	1.779351681470871
454	In addition, primary care trusts (PCTs) were given star ratings for the first time this year.	Primary Care Trusts and Mental Health Trusts have also been formally rated for the first time this year.	3.81763756275177
455	You can buy it on amazon for $5.	You can buy it on ebay for $25 and up.	3.235258162021637
456	A woman is water skiing.	A woman is slicing fish.	1.1347925662994385
457	You shouldn't feel any obligation at all.	You don't need sauce at all.	2.131189852952957
458	Shares of Mandalay closed down eight cents to $29.42, before the earnings were announced.	Shares of Mandalay closed down 8 cents at $29.42 Thursday.	4.522160887718201
459	Work into it slowly.	It seems to work.	1.431298702955246
460	Further testing is still under way, but at this stage, given the early detection, the outlook in such instances would be positive, the specialist said yesterday.	But at this stage, given the early detection, the outlook in such instances would be positive, he said.	3.8474613428115845
461	People gathered in a room.	People gathered together in a room.	4.871463179588318
462	A man is cutting up a cucumber.	A man is slicing a cucumber.	4.645214676856995
463	I expect Japan to keep conducting intervention, but the volume is likely to fall sharply, said Junya Tanase, forex strategist at JP Morgan Chase.	"Junya Tanase, forex strategist at JP Morgan Chase, said ""I expect Japan to keep conducting intervention, but the volume is likely to fall sharply."""	4.8468247056007385
464	MGM, NBC and Liberty executives were not immediately available for comment.	A Microsoft spokesman was not immediately available to comment.	3.162546455860138
465	a man working at the steel mill	A man working in a foundry.	2.97269344329834
466	A woman is stabbing a potato with a fork.	A woman is puncturing a potato with a fork.	4.417601823806763
467	She was taken by ambulance to Charing Cross Hospital in Hammersmith.	She was taken to Charing Cross Hospital, where she remained critically ill last night.	2.895801067352295
468	A woman is exercising.	A man is dancing.	0.9023883938789368
469	I think it is depends on the program.	It depends on how the term is used I think.	2.200850546360016
470	2 Cows are in a field.	Two sheep are in a field.	2.4351146817207336
471	A man pours rice into a pot.	A man is putting rice in a bowling pot.	4.098917841911316
472	People on motorcycles wearing racing gear ride around a racetrack	People on motorcycles ride around a racetrack	4.779982268810272
473	"The Justice Department filed suit Thursday against the state of Mississippi for failing to end what federal officials call ""disturbing"" abuse of juveniles and ""unconscionable"" conditions at two state-run facilities."	The Justice Department filed a civil rights lawsuit Thursday against the state of Mississippi, alleging abuse of juvenile offenders at two state-run facilities.	3.6522918939590454
474	a man wearing a gray hat fishing out of a fishing boat.	A man wearing a straw hat and fishing vest in a stream.	3.1479722261428833
475	A man in a top hat rides a white horse.	A man with a top hat riding a white horse.	4.951385259628296
476	A soldier walks a dog.	A man walks a dog.	3.7748318910598755
477	Take a look at these:	Take a look at this: 	4.02908593416214
478	Researchers found the fossils in a semidesert area of Venezuela, about 250 miles west of Caracas.	Phoberomys' skeleton was unearthed 250 miles west of Caracas, Venezuela.	3.4578782320022583
479	A boy with dark hair is in water and is looking up.	The man is short hair.	1.7142784595489502
480	A man is making a bed.	A man is speaking to an audience.	0.7855188846588135
481	In the US, it will depend on the school.	It really depends on the school and the program.	4.240272045135498
482	The consensus estimate of analysts polled by Thomson First Call called for a profit of $1.70 per share.	Analysts polled by Reuters Research, a unit of Reuters Group Plc, on average forecast profit of $1.69 per share.	3.3884137868881226
483	A man is cycling.	A boy is riding a bicycle.	3.210219144821167
484	Young couple sitting on a black couch.	Young couple sitting on couch.	4.510068893432617
485	Hope this is what you are looking for.	Is this the kind of thing you're looking for ?	2.4630339443683624
486	Site Finder has been visited 65 million times since its introduction, Galvin said.	Through Sunday, Sept. 21, Site Finder has been visited over 65 million times by Internet users.	3.7827998399734497
487	A deer jumps a fence.	A deer is jumping over a fence.	4.799045920372009
488	A boy is playing a key-board.	A little boy is playing a keyboard.	4.020569026470184
489	The support will come as a free software upgrade called WebVPN for current customers that have support contracts.	The upgrade will be available as a free download for current customers with SmarNet support in January 2004.	2.504062056541443
490	Indeed, Mr. Weill, a self-described workaholic, said he planned to remain very involved in the company.	Still, Mr. Weill will remain very much a power at the company.	3.2385000586509705
491	Its keywords are supported by Chinese language Web portals.	Chinese language Web portals also support 3721 keywords, the Web site said.	3.3484238386154175
492	There are a few things I think you should do.	There are quite a few things you would need to do;	3.053073287010193
493	A man is praying.	A man is dancing.	1.0043544322252274
494	A pole is behind a person that is playing peekaboo with a child.	There is a child with a ball	1.874849945306778
495	Only Intel Corp.'s 0.3 percent yield was lower.	Only Intel Corp. has a lower dividend yield.	3.411340117454529
496	A young Asian girl is applying eyeliner.	A girl is putting on eye makeup.	3.7175559997558594
497	A group of horses grazing in a field.	Group of horses grazing in grassy field.	4.773800075054169
498	Blond boy jumping onto deck.	A boy jumping down a wet inflatable slide.	2.519901990890503
499	You should do it.	You should prime it first.	2.1017828583717346
500	You answered your own question.	You have answered your own question.	4.553396701812744
501	Four dogs stand in the snow.	Four dogs playing in the snow.	4.479531943798065
502	A girl in a riding hat on a horse.	A girl riding a brown horse.	3.967098593711853
503	It is impossible to answer this question without a form check.	It is difficult, if not impossible, to give a complete answer to this question.	2.9885482788085938
504	You have to decide what you want to get out of this.	You have to know what you want to do.	2.639285922050476
505	Schofield got Toepfer to admit on cross-examination that she ignored many of O'Donnell's suggestions and projects.	But under cross-examination by O'Donnell's attorney, Lorna Schofield, Toepfer conceded she had ignored many of O'Donnell's suggestions and projects.	4.524501264095306
506	I had the same problem as you.	I have exactly the same problem.	4.163673520088196
507	The Episcopal Diocese of Central Florida became one of the first in the nation Saturday to officially reject the national denomination's policies on homosexuality.	The Episcopal Diocese of Central Florida voted Saturday to repudiate a decision by the denomination's national convention to confirm a gay man as bishop.	3.3927232027053833
508	A woman is playing in the ocean.	A woman is preparing shrimp to cook.	1.8778440356254578
509	A pile of used wooden building materials with a chair on top.	Pile of wooden debris with chair on top.	3.9018329977989197
510	Unfortunately the answer to your question is we simply do not know.	"My answer to your question is ""Probably Not""."	1.9862791895866394
511	a young man wearing a white t-shirt and green and black shorts standing on a stump.	A man wearing a white shirt and red and black shorts is running on the sidewalk.	2.311827838420868
512	The key thing to realize here is that it's not your job to make people do their work.	It really isn't your problem how they are going to find a qualified person to do the job.	2.6436978578567505
513	It's also a matter of taste.	It's definitely just a matter of preference.	2.8561684489250183
514	On July 22, Moore announced he would appeal the case directly to the U.S. Supreme Court.	Moore of Alabama says he will appeal his case to the nation's highest court.	3.4963494539260864
515	As well as the dolphin scheme, the chaos has allowed foreign companies to engage in damaging logging and fishing operations without proper monitoring or export controls.	Internal chaos has allowed foreign companies to set up damaging commercial logging and fishing operations without proper monitoring or export controls.	4.395801424980164
516	An okapi is eating from a tree.	A moose drinks from a sprinkler.	0.2151346206665039
517	Some of what you can do:	Not much you can do besides:	2.992240786552429
518	The man is kissing and hugging the woman.	A man is hugging and kissing a woman.	4.911418557167053
519	A kid is talking in class.	A girl is going to class.	2.985154390335083
520	Two people are in bed.	Two boxers are in the ring.	1.113826185464859
521	Black and white cows grazing in a pen.	Two black and white cows drinking out of a pond.	2.5830185413360596
522	The tech-laced Nasdaq Composite Index .IXIC eased 5.16 points, or 0.32 percent, at 1,590.75, breaking a six-day string of gains.	The tech-heavy Nasdaq Composite Index .IXIC was off 0.11 percent, or 1.78 points, at 1,594.13.	2.41010844707489
523	A woman is cutting an onion.	A woman is cleaning a garden.	1.7561349272727966
524	people walk home	People waiting.	0.7454345375299454
525	A man is erasing a chalk board.	A woman is dancing, and singing.	0.056444937363266945
526	You don't need to know everything.	You don't have to know.	3.6508524417877197
527	A man is playing the guitar and singing.	A man sings with a guitar.	4.494784474372864
528	How do you do that?	How should you do that?	3.8235068321228027
529	A black and white cow looking through the fence.	A black and white dog looking at the camera.	1.5153869986534119
530	Democrats currently hold a 17-15 advantage in the state's congressional delegation.	The Texas congressional delegation now is 17-15 Democratic.	3.731961250305176
531	Singapore reported no suspected SARS cases Wednesday, but officials quarantined 70 people who had contact with the Taiwanese patient.	Still, Singapore quarantined 70 people who had been in close contact with the scientist.	3.256256878376007
532	These despicable acts were committed by killers whose only faith is hate, Bush said, adding that the United States will find the killers.	These despicable acts were committed by killers whose only faith is hate and the United States will find the killers and they will learn the meaning of American justice.	3.6875516176223755
533	A man is performing labor.	A man is performing today.	1.7545264959335327
534	Another was in serious condition at Northwest Medical Center in Springdale.	At Northwest Medical Center of Washington County in Springdale, one child is in serious condition.	4.0533047914505005
535	A man is playing a musical keyboard.	A man is playing a keyboard piano.	4.44316565990448
536	This is a very unusual request.	This sounds a bit unusual.	2.648683786392212
537	A pitcher on a mound throws a baseball.	A boy in the middle of a pitch at a baseball game.	3.158276677131653
538	People are dancing outside.	A group of people are dancing.	4.220562279224396
539	There are a few possible reasons.	There are a few reasons that paint wrinkles.	1.8753978610038757
540	You want to start in the room that is the largest to make sure you have the straightest start.	You will have to start with the clinic., and maybe move on to the insurance company.	0.4504500702023506
541	Analysts expected earnings of 27 cents a share on revenue of $17.7 billion, Thomson First Call says.	Hewlett-Packard is putting in for a second-quarter profit of $659 million, or 29 cents a share, on revenue of $18 billion.	1.8191155791282654
542	A cat is playing on the floor.	A man is slicing garlic.	-0.4582627862691879
543	Large group of people standing outside of a building.	A group of people are ice skating in a big city.	1.6455429792404175
544	A light brown dog runs down a path happily.	A pale dog runs down a path.	4.010832905769348
545	A man in a black suit is surfing along a crashing wave.	A surfer wearing a black wet suit is riding a a white wave in the ocean.	3.3189839124679565
546	A person is scrubbing a zucchini.	A woman is scrubbing a zucchini with a vegetable brush.	4.449334740638733
547	This is a problem that the professor has to deal with.	This is a big problem.	2.242240607738495
548	"During the hearing, Morales expressed ""sincere regrets and remorse"" for his actions."	"Morales, who pleaded guilty in July, expressed ""sincere regret and remorse"" for his crimes."	4.331764578819275
549	A person is peeling a potato.	The man is peeling a potato.	4.7480350732803345
550	A boy skateboards down the railing of some graffiti stairs	A skateboarder slides down a handrail on his feet.	3.209693431854248
551	A man is playing a guitar.	A man is playing a trumpet.	1.9155752658843994
552	Local police authorities are treating the explosion as a criminal matter and nothing has been ruled out.	Acting New Haven Police Chief Francisco Ortiz said police were treating the explosion as a criminal matter.	2.877836227416992
553	A black and white cat is high up on tree branches.	Black and white lamb with tag in right ear.	0.6528311222791672
554	A brown and white cow in a field looking into the camera.	The black and white cat is looking up at the camera.	1.3943466544151306
555	The woman is kneeling next to a cat.	A girl is standing next to a man.	1.2929162383079529
556	The BlueCore3-Multimedia includes a 16-bit stereo audio CODEC with dual ADC and DAC for stereo audio.	BlueCore3-Multimedia contains an open platform DSP co-processor and also includes a 16-bit stereo audio codec with dual ADC and DAC for stereo audio.	4.672036170959473
557	McGill also detailed the hole that had been cut in the Caprice's trunk.	McGill also said a dark glove was stuffed into a hole that had been cut in the Caprice's trunk.	4.0233540534973145
558	Yes, there is a reason to not do what you propose.	Valid reasons to feel the way you do, but not a reason to resign.	1.8124282360076904
559	The two dogs are playing in the yard.	Two dogs are playing on the grass.	4.094251394271851
560	Brendsel and chief financial officer Vaughn Clarke resigned June 9.	The company's chief executive retired and chief financial officer resigned.	2.274818569421768
561	A man mixes vegetables in a pot.	A person is stirring vegetables in a pot.	4.15401816368103
562	There's not a lot you can do about that.	I'm afraid there's not really a lot you can do.	3.392127752304077
563	Bremer said one initiative is to launch a US$70 million nationwide program in the next two weeks to clean up neighborhoods and build community projects.	Bremer said he would launch a $70-million program in the next two weeks to clean up neighborhoods across Iraq and build community projects, but gave no details.	3.678925633430481
564	I've had this same problem.	I've had this problem while working in a pubs.	2.8251859545707703
565	It depends on what they are.	It depends on what they are evaluating, and how.	1.9752117991447449
566	A man is putting garlic on some bread slices.	A man is sprinkling seasoning on several split and buttered loaves of bread.	2.465079426765442
567	A gray cat laying on a brown table.	A grey cat lying on a wooden table.	4.454685747623444
568	A woman is slicing ginger.	A woman is cutting potatoes.	1.957872211933136
569	A panda bear is chewing on a stick.	A baby panda plays with a stick.	3.6384525895118713
570	Navistar shares were down 44 cents, or 1.1 percent, at $41.19 on the New York Stock Exchange after falling as low as $39.93.	Navistar shares rose a penny to $41.64 at late afternoon on the New York Stock Exchange after earlier falling as low as $39.93.	3.326229155063629
571	Two women in a clothing store.	Two women in a sailboat.	1.8705615401268005
572	Sony Ericsson also said it would shut down its GSM/UMTS R&D center in Munich, Germany, to increase profitability.	Sony Ericsson also said it plans to close its R&D site in Munich, Germany, for GSM and UMTS handsets.	3.9543652534484863
573	Kodak expects earnings of 5 cents to 25 cents a share in the quarter.	Analysts surveyed by Thomson First Call had expected Kodak to earn 68 cents a share for the quarter.	1.445656269788742
574	A close-up of a gray cat with green eyes.	A close-up of a cat on a cream sofa.	2.399081140756607
575	I'm going to be very direct here.	I'm going to be blunt, here: You don't.	0.8915984630584717
576	Now you don't have to be perfect on every answer.	You don't have to know.	1.4675118029117584
577	Two brown dogs runs through the water.	Two brown dogs running through water.	4.91771787405014
578	There are two things to consider:	I think there are two important things to consider:	4.462136924266815
579	A brown and white dog is running through the snow.	a brown and white dog is running on the grass.	2.9248633980751038
580	The lady looks sad because no one is buying her wares.	The lady is selling things.	2.348475158214569
581	Two dogs and one cat sitting on couch.	Two dogs and a cat resting on a couch.	4.504433870315552
582	Under Mexican law, bounty hunting is considered a form of kidnapping.	Bounty hunting is illegal in Mexico, and the bounty hunter was charged with kidnapping.	4.324624836444855
583	A little boy hits a golf ball.	The little boy swung at the golf ball.	4.483741521835327
584	A boy studies a calendar.	A boy is looking at a calendar.	4.561030268669128
585	A man is playing a guitar.	A man is eating pasta.	0.22255828604102135
586	A tan girl in a floral bikini is swimming in dark blue waters.	a little girl in a flowered bathingsuit runs through the sand at the beach	2.615266740322113
587	A boy is very close to a girl.	A girl is close to a boy whose face is not shown.	3.810625672340393
588	The birds are swimming in the water.	Birds fly low over water.	3.196232318878174
